{
  "schema": "ucc.transfer-receipt",
  "schema_version": 1,
  "id": "rpt_01K0A6R4V8W6E3M4M8Y0R9J2QT",
  "created_at": "2026-08-22T12:01:00.000Z",
  "created_by": "act_01K0A6R4V8W6E3M4M8Y0R9J2QA",
  "record_version": 1,
  "transfer_id": "xfer_01K0A6R4V8W6E3M4M8Y0R9J2QX",
  "node_id": "node_01K0A6R4V8W6E3M4M8Y0R9J2QX",
  "receipt_type": "payload_staged",
  "sha256": "sha256:0123456789abcdef0123456789abcdef0123456789abcdef0123456789abcdef",
  "size_bytes": 10240,
  "recorded_at": "2026-08-22T12:01:00.000Z"
}
